{
  "$schema": "../contracts/evidence_lineage.v1.schema.json",
  "schema": "cra.evidence_lineage.v1",
  "status": "CURRENT_STATE_SPEC",
  "purpose": "Dellの配信SUTからarenaのfacts-only投影、cra-01のNO_ACTION runtime、証拠保存とsoak oracleまでを、identity・freshness・restart domainごとに追跡する正本マップ",
  "boundaries": {
    "canonical_scope": "リポジトリ内の現行構造、契約、責務、failure domain。実環境の現在値は含めない。",
    "excluded_current_values": [
      "running release and source commit",
      "epoch id and timestamps",
      "PID, Pod UID, container ID, boot ID, sequence and sample count",
      "live health, restart count and gate verdict"
    ],
    "mutation_authority": "NONE"
  },
  "owner_verification": {
    "catalog": "harness/scenarios/owner_observation_chaos_v1.json",
    "component_id": "OwnerObservationPipeline",
    "duplication_policy": "REFERENCE_CANONICAL_CATALOG"
  },
  "hosts": [
    {
      "id": "dell",
      "expected_host_id": "dell-stream-runtime",
      "role": "stream_v3 production runtime SUT and signed read-only observation source",
      "authority": "stream runtime ownership, bounded local effect fence; no CRA policy authority"
    },
    {
      "id": "arena",
      "expected_host_id": "arena-monitoring-facts",
      "role": "Monitoring facts, Dell packet relay and signed arena observation",
      "authority": "facts and transport only; no recovery authorization"
    },
    {
      "id": "cra",
      "expected_host_id": "cra-01-central-authority",
      "role": "central policy, NO_ACTION runtime, durable intent truth and soak",
      "authority": "central authority; command delivery remains disabled in this profile"
    }
  ],
  "layers": [
    {"id": "streaming_sut", "label": "Dell streaming SUT", "order": 1},
    {"id": "monitoring_observation", "label": "Dell to arena to CRA Monitoring evidence", "order": 2},
    {"id": "soak_observation", "label": "Three-host signed recovery observation", "order": 3},
    {"id": "soak_certification", "label": "Committed history and deterministic soak evaluation", "order": 4},
    {"id": "control_safety", "label": "CRA NO_ACTION and effect-safety boundary", "order": 5}
  ],
  "nodes": [
    {
      "id": "dell.host",
      "label": "Dell physical host",
      "kind": "SUT",
      "layer": "streaming_sut",
      "host": "dell",
      "authority": "SUT_OWNER",
      "failure_domain": "SUT",
      "source_refs": ["docs/oracle/00_restart_authority_overview.md", "tools/collect_cra_no_action_soak.py"],
      "implementation_refs": [],
      "unit_templates": [],
      "identity_fields": ["physical_host_id", "physical_host_boot_id"],
      "freshness_fields": ["observed_at"],
      "current_value_policy": "LIVE_OVERLAY_ONLY"
    },
    {
      "id": "dell.deployment",
      "label": "stream_v3 Kubernetes Deployment",
      "kind": "SUT",
      "layer": "streaming_sut",
      "host": "dell",
      "authority": "SUT_OWNER",
      "failure_domain": "SUT",
      "source_refs": ["src/dell_recovery_agent/target_snapshot.py", "tools/collect_cra_no_action_soak.py"],
      "implementation_refs": ["dell_recovery_agent.target_snapshot::main"],
      "unit_templates": [],
      "identity_fields": ["namespace", "deployment_name", "deployment_generation"],
      "freshness_fields": ["resource_version", "read_started_at", "read_completed_at"],
      "current_value_policy": "LIVE_OVERLAY_ONLY"
    },
    {
      "id": "dell.pod",
      "label": "stream_v3 Pod",
      "kind": "SUT",
      "layer": "streaming_sut",
      "host": "dell",
      "authority": "SUT_OWNER",
      "failure_domain": "SUT",
      "source_refs": ["src/dell_recovery_agent/target_snapshot.py", "src/runtime_boundary/recovery_publisher.py"],
      "implementation_refs": ["dell_recovery_agent.target_snapshot::main"],
      "unit_templates": [],
      "identity_fields": ["namespace", "pod_uid", "pod_name"],
      "freshness_fields": ["resource_version", "observed_at", "valid_until"],
      "current_value_policy": "LIVE_OVERLAY_ONLY"
    },
    {
      "id": "dell.container",
      "label": "stream-engine container and sibling readiness",
      "kind": "SUT",
      "layer": "streaming_sut",
      "host": "dell",
      "authority": "SUT_OWNER",
      "failure_domain": "SUT",
      "source_refs": ["src/dell_recovery_agent/target_snapshot.py", "tools/collect_cra_no_action_soak.py"],
      "implementation_refs": ["dell_recovery_agent.target_snapshot::main"],
      "unit_templates": [],
      "identity_fields": ["container_name", "container_id", "restart_count"],
      "freshness_fields": ["observed_at", "valid_until"],
      "current_value_policy": "LIVE_OVERLAY_ONLY"
    },
    {
      "id": "dell.owner",
      "label": "stream-engine owner process",
      "kind": "SUT",
      "layer": "streaming_sut",
      "host": "dell",
      "authority": "SUT_OWNER",
      "failure_domain": "SUT",
      "source_refs": ["src/runtime_boundary/child_registry.py", "src/runtime_boundary/recovery_publisher.py"],
      "implementation_refs": [
        "runtime_boundary.child_registry::ChildLifecycleRegistry.install",
        "runtime_boundary.child_registry::ChildLifecycleRegistry.snapshot_locked",
        "runtime_boundary.recovery_publisher::RecoveryEvidencePublisher.publish"
      ],
      "unit_templates": [],
      "identity_fields": ["owner_pid", "owner_start_ticks"],
      "freshness_fields": ["observed_at", "valid_until"],
      "current_value_policy": "LIVE_OVERLAY_ONLY"
    },
    {
      "id": "dell.ffmpeg",
      "label": "production FFmpeg child",
      "kind": "SUT",
      "layer": "streaming_sut",
      "host": "dell",
      "authority": "SUT_OWNER",
      "failure_domain": "SUT",
      "source_refs": ["src/runtime_boundary/recovery_evidence.py", "src/runtime_boundary/recovery_publisher.py"],
      "implementation_refs": ["runtime_boundary.recovery_evidence::owner_evidence"],
      "unit_templates": [],
      "identity_fields": ["ffmpeg_pid", "ffmpeg_generation", "child_pid", "child_start_ticks", "owner_pid"],
      "freshness_fields": ["observed_at", "valid_until"],
      "current_value_policy": "LIVE_OVERLAY_ONLY"
    },
    {
      "id": "dell.aux_child",
      "label": "registered auxiliary child",
      "kind": "SUT",
      "layer": "streaming_sut",
      "host": "dell",
      "authority": "SUT_OWNER",
      "failure_domain": "SUT",
      "source_refs": ["src/runtime_boundary/child_registry.py", "src/runtime_boundary/recovery_publisher.py"],
      "implementation_refs": ["runtime_boundary.child_registry::ChildLifecycleRegistry.snapshot_locked"],
      "unit_templates": [],
      "identity_fields": ["pid", "start_ticks", "parent_pid", "registered_owner_pid", "registered_owner_start_ticks"],
      "freshness_fields": ["registry_snapshot_at", "proc_read_at"],
      "current_value_policy": "LIVE_OVERLAY_ONLY"
    },
    {
      "id": "dell.owner_export",
      "label": "owner-produced read-only evidence export",
      "kind": "STORE",
      "layer": "streaming_sut",
      "host": "dell",
      "authority": "OBSERVATION_ONLY",
      "failure_domain": "OBSERVATION_SOURCE",
      "source_refs": ["src/runtime_boundary/recovery_evidence.py", "src/runtime_boundary/recovery_publisher.py", "docs/oracle/04_owner_observation_contract.md"],
      "implementation_refs": ["runtime_boundary.recovery_publisher::RecoveryEvidencePublisher.publish"],
      "unit_templates": [],
      "identity_fields": ["schema", "release_id", "source_commit", "host_boot_id", "owner_pid", "owner_start_ticks"],
      "freshness_fields": ["observed_at", "valid_until"],
      "current_value_policy": "LIVE_OVERLAY_ONLY"
    },
    {
      "id": "arena.host",
      "label": "Arena physical host",
      "kind": "OBSERVER",
      "layer": "monitoring_observation",
      "host": "arena",
      "authority": "OBSERVATION_ONLY",
      "failure_domain": "OBSERVATION_SOURCE",
      "source_refs": ["docs/oracle/00_restart_authority_overview.md", "src/cra_no_action_soak/resilient_host_status_relay.py"],
      "implementation_refs": [],
      "unit_templates": [],
      "identity_fields": ["physical_host_id", "physical_host_boot_id"],
      "freshness_fields": ["observed_at"],
      "current_value_policy": "LIVE_OVERLAY_ONLY"
    },
    {
      "id": "dell.monitoring_publisher",
      "label": "Dell target and transport observation publisher",
      "kind": "OBSERVER",
      "layer": "monitoring_observation",
      "host": "dell",
      "authority": "OBSERVATION_ONLY",
      "failure_domain": "OBSERVATION_SOURCE",
      "source_refs": ["src/dell_recovery_agent/observation_publisher.py", "contracts/cra_dell_recovery/v1/observation_bundle.schema.json"],
      "implementation_refs": ["dell_recovery_agent.observation_publisher::DellObservationPublisher.build"],
      "unit_templates": [],
      "identity_fields": ["source_instance_id", "source_release_id", "observation_sequence", "target_snapshot"],
      "freshness_fields": ["observed_at", "valid_until"],
      "current_value_policy": "LIVE_OVERLAY_ONLY"
    },
    {
      "id": "dell.monitoring_server",
      "label": "Dell GET-only mTLS observation server",
      "kind": "TRANSPORT",
      "layer": "monitoring_observation",
      "host": "dell",
      "authority": "TRANSPORT_ONLY",
      "failure_domain": "TRANSPORT",
      "source_refs": ["src/dell_recovery_agent/observation_server.py", "ops/systemd/dell-observation-server@.service"],
      "implementation_refs": ["dell_recovery_agent.observation_server::main"],
      "unit_templates": [{"template": "dell-observation-server@<release>.service", "definition": "ops/systemd/dell-observation-server@.service"}],
      "identity_fields": ["server_release_id", "systemd_invocation_id"],
      "freshness_fields": ["served_observation_observed_at", "server_resource_observed_at"],
      "current_value_policy": "LIVE_OVERLAY_ONLY"
    },
    {
      "id": "arena.dell_monitoring_pull",
      "label": "Arena Dell observation puller",
      "kind": "TRANSPORT",
      "layer": "monitoring_observation",